work_item_id,source_id,work_category,work_item,current_status,output_status,blocking_level,next_action,evidence_output
P2-WORK-001,P2SRC-004,project_scope,"Extract planning objective, target park scope, and project positioning from DOCX.",ready_for_semantic_breakdown,needs_review,important,"Use extracted text to draft objective/scope assumptions, then review against source lines.",30_extraction/p2_real_site/osen_project_plan_text.txt
P2-WORK-002,P2SRC-004,business_format,"Break down planned formats, nodes, scenes, and operational assumptions from DOCX.",ready_for_semantic_breakdown,needs_review,important,Generate a structured assumption pool; keep assumptions separate from measured evidence.,30_extraction/p2_real_site/osen_project_plan_profile.json
P2-WORK-003,P2SRC-001,north_cad_proxy,Use north CAD PDF text/page profile as readable proxy for drawing pages.,ready_for_manual_page_review,needs_review,important,"Review high-text and high-vector pages, identify candidate nodes/labels to map after DWG conversion.",30_extraction/p2_real_site/osen_north_cad_pdf_pages.csv
P2-WORK-004,P2SRC-002,dwg_conversion,Convert or inspect DWG geometry/layers for 奥森北园(字体放大)-改造建筑示意_t5.dwg.,pending_conversion,pending_conversion,blocking_for_geometry_not_for_text_index,Install/use trusted DWG converter or request DXF/PDF export; do not claim geometry parsing before conversion.,40_quality_evidence/p2_real_site_source_catalog.csv
P2-WORK-005,P2SRC-003,dwg_conversion,Convert or inspect DWG geometry/layers for 奥森南园（字体放大）-改造建筑示意_t5.dwg.,pending_conversion,pending_conversion,blocking_for_geometry_not_for_text_index,Install/use trusted DWG converter or request DXF/PDF export; do not claim geometry parsing before conversion.,40_quality_evidence/p2_real_site_source_catalog.csv
P2-WORK-006,P2SRC-004;P2SRC-001,input_gap_check,Check whether current real-site materials support simulation inputs without PPT.,prepared,needs_review,important,Use p2_simulation_input_requirements.csv as the gate before building the simulation prototype.,70_outputs/processed_tables/p2_simulation_input_requirements.csv
P2-WORK-007,P2SRC-004,project_drift_check,Compare real project objective against existing park commercial simulation objective.,prepared,needs_review,important,Confirm whether the objective remains site selection simulation or shifts to renovation/project planning support.,40_quality_evidence/p2_real_site_preparation_report.md
